"London (2nd Edition)","362","Board and Card Game","Tom Wolan","A card drafting game where you are tasked with rebuilding the city of London after the Great Fire. Another Martin Wallace game.","0","Teen (13+)","4","3","0","Saturday at  9:00 AM","2022-10-08T13:00:00","120","https://boardgamegeek.com/boardgame/236191/london-second-edition","Ballroom","205","2022-08-11T13:02:55","2022-09-09T01:55:12","/conventions/u-con-2022/schedule/362","Beginner","Average","2",,,,"6'x18"" Rectangle (6 chairs)"
"Jump the Shark","431","Role Playing","Joshua Brubaker","The Writers, with joy in their hearts and a story to tell, crafted a wonderful, beautiful, 2-season show. Then the Network signed it for another 8 seasons, but now we’re all out of ideas.","0","Teen (13+)","5","2","0","Saturday at  9:00 AM","2022-10-08T13:00:00","240","http://","Conference B","Conference B 1","2022-08-27T19:39:09","2022-09-08T00:01:22","/conventions/u-con-2022/schedule/431","Beginner","Average","1","We Hate Bards","Jump the Shark","",""
"Express","19","Board and Card Game","allen stiles","","0","Adult (18+)","12","1","0","Saturday at  9:00 AM","2022-10-08T13:00:00","180","http://","Ballroom","317","2022-07-15T17:17:04","2022-09-02T16:30:23","/conventions/u-con-2022/schedule/19","Beginner","Average","3","Train Gamers Association",,"n/a","6'x18"" Rectangle (6 chairs)"
"Have You No Heart? (WBW-DC-UCON-02)","508","Organized Play","John Rogers","In Basht, help Robin Goodman reunite a girl with her father. Part of a series, can stand alone. For experienced players with characters level 5-10. (Available if needed) (tier two). (CON PREMIERE)","0","Family Friendly (7+)","7","0","0","Saturday at  9:00 AM","2022-10-08T13:00:00","240","http://","Clubhouse","Clubhouse 4","2022-09-02T13:05:57","2022-09-03T15:04:08","/conventions/u-con-2022/schedule/508","Some XP","Average","3","U-Con Adventurers League","D&D","5th",""
"05-06 Tarnished Legacy: Historia's Holdout","286","Organized Play","Edward A Kabara","A complex owned by Historia-Prime has been discovered in Absalom Station! Explore the complex, discern its purpose, and shut it down. For levels 1-4, pregenerated characters available.","0","Teen (13+)","6","2","0","Saturday at  9:00 AM","2022-10-08T13:00:00","270","http://","Elizabeth Ann","Table 09","2022-08-06T20:18:54","2022-09-12T21:30:44","/conventions/u-con-2022/schedule/286","Beginner","Average","2","Michigan Pathfinder and Starfinder Societies","Starfinder","1st edition","5' Round"
"Scythe","76","Board and Card Game","Blair Reamy","Factions vie for dominance in a war-torn, mech-filled, dieselpunk 1920s Europe. Base game for new players; we can add expansions if players are experienced or willing to add to the complexity.","0","Teen (13+)","7","7","0","Saturday at 10:00 AM","2022-10-08T14:00:00","180","https://stonemaiergames.com/games/scythe/","Ballroom","204","2022-07-23T19:03:18","2022-09-09T00:31:06","/conventions/u-con-2022/schedule/76","Beginner","Complex","2","Amorphous Blob Games",,,"6'x30"" Rectangle (6 chairs)"
"Ogre!!!","318","Miniatures","David Nelson","The Warren cyber tank plant come under attack by the forces of the Canada empire.  Can human survive in the face of cold blood machine?  Can you stop the might Ogre?","0","Teen (13+)","8","0","0","Saturday at 10:00 AM","2022-10-08T14:00:00","180","http://","Ballroom","403","2022-08-06T20:20:28","2022-08-27T19:29:36","/conventions/u-con-2022/schedule/318","Beginner","Simple","2","na",,,"96 x 30"
"Intrepid: Disaster on the ISS","207","Board and Card Game","Scott Allen Rutter","Join the crew of the International Space Station as they struggle to survive a meteor storm! Can the team put together the resources they need to deal with this crisis? Let's find out!","0","Family Friendly (7+)","4","2","0","Saturday at 10:00 AM","2022-10-08T14:00:00","240","http://","Ballroom","309","2022-08-03T23:30:13","2022-09-14T22:12:45","/conventions/u-con-2022/schedule/207","Beginner","Average","2",,,,"6'x18"" Rectangle (6 chairs)"
"Droidicide- Destroy the Droid Factory","48","Board and Card Game","David Perrin","Star Wars Themed Zombicide (original rule-set) with some “home rule” modifications, custom equipment cards, & swap out zombies for droids.  Game will be taught, no experience needed, Family Friendly.","0","Family Friendly (7+)","6","6","0","Saturday at 10:00 AM","2022-10-08T14:00:00","180","http://","Ballroom","412","2022-07-23T18:42:41","2022-09-12T12:23:04","/conventions/u-con-2022/schedule/48","Beginner","Average","2","Dave Perrin",,,"6'x18"" Rectangle (6 chairs)"
"Car Wars Sixth Edition Demo","564","Miniatures","Mark Grocki","Play a full game of Car Wars Sixth Edition from Steve Jackson Games! Players will be using demo car builds and be taught everything they need to know to drive, ram, and shoot their way to victory!","0","Family Friendly (7+)","4","3","0","Saturday at 10:00 AM","2022-10-08T14:00:00","180","https://carwars.sjgames.com","Ballroom","404","2022-09-06T22:57:11","2022-09-15T14:57:05","/conventions/u-con-2022/schedule/564","Beginner","Average","1","Steve Jackson Games Men in Black",,,"96 x 48"
"Clay-o-rama","113","Board and Card Game","Becky Reamy","Clay-o-rama is an opportunity to create an amazing clay creature out of your imagination and then battle it to the death against the other creations. I run a fast and loose version of the game.","0","Teen (13+)","8","5","0","Saturday at 10:00 AM","2022-10-08T14:00:00","120","https://gusandco.net/wp-content/uploads/2021/05/clayorama.pdf","Ballroom","203","2022-07-28T14:33:55","2022-09-14T15:22:48","/conventions/u-con-2022/schedule/113","Beginner","Simple","5","Amorphous Blob Games",,,"5' Round (7 chairs)"
"Macao","567","Board and Card Game","Peter Cerra","A Stefan Feld game about shipping goods, avoiding penalties, and dice rolls that don’t go your way. Despite the dice, it’s very strategy driven. Being reimplemented as Amsterdam.","0","Adult (18+)","3","0","0","Saturday at 10:00 AM","2022-10-08T14:00:00","180","https://boardgamegeek.com/boardgame/55670/macao","Ballroom","210","2022-09-06T22:58:00","2022-09-06T23:09:45","/conventions/u-con-2022/schedule/567","Beginner","Complex","2",,,,"6'x30"" Rectangle (6 chairs)"
"Mutants & Masterminds Marvel","343","Role Playing","Paul McNeil","Powerful heroes of the Marvel universe band together to thwart a growing threat.","0","Adult (18+)","5","5","2","Saturday at 10:00 AM","2022-10-08T14:00:00","240","http://","Conference G","Conference G 3","2022-08-08T11:43:46","2022-09-02T15:01:09","/conventions/u-con-2022/schedule/343","Beginner","Simple","5",,"Mutants & Masterminds","3e","5' Round"
"Tyrants of the Underdark","393","Board and Card Game","Jason Miller","Fight for control of the Underdark as the leader of one of four Drow Houses in this game combining deck-building and area control.","0","Teen (13+)","4","4","0","Saturday at 10:00 AM","2022-10-08T14:00:00","120","https://boardgamegeek.com/boardgame/189932/tyrants-underdark","Ballroom","208","2022-08-17T22:46:55","2022-09-09T20:08:40","/conventions/u-con-2022/schedule/393","Beginner","Average","2",,,,"6'x30"" Rectangle (6 chairs)"
"Cthulhu Wars","229","Board and Card Game","David Reynolds","Area control game of alien gods battling over control of earth. Asymmetrical factions play differently, yet share an elegant and easy to learn system. Played on a large map with beautiful miniatures.","0","Adult (18+)","5","5","0","Saturday at 10:00 AM","2022-10-08T14:00:00","180","http://","Ballroom","416","2022-08-03T23:39:26","2022-09-04T16:31:22","/conventions/u-con-2022/schedule/229","Beginner","Average","2","Ypsi Gaming Group",,"","8'x30"" Rectangle (6 chairs)"
"Castles Of Mad King Ludwig - Colossal Edition","574","Board and Card Game","James Hoxsey","n this 1-5 player tile-laying game, players are tasked with building an amazingly extravagant castle for King Ludwig II of Bavaria...one room at a time.  Enjoy playing the COLOSSAL edition!","0","Teen (13+)","5","4","0","Saturday at 10:00 AM","2022-10-08T14:00:00","180","https://beziergames.com/products/castles","Ballroom","410","2022-09-10T12:53:09","2022-09-14T17:53:15","/conventions/u-con-2022/schedule/574","Beginner","Average","2",,,,"8'x30"" Rectangle (6 chairs)"
"Curse of the Spiderwood","415","Role Playing","Marc Tassin","Finding the children lost in Spiderwood was easy. The problem is the forest doesn't plan to let you leave. It's a race against the clock to overcome the strange curse of this enchanted forest.","0","Teen (13+)","6","2","0","Saturday at 10:00 AM","2022-10-08T14:00:00","120","http://https://aetaltis.com/conventions/","Conference E","Conference E 7","2022-08-25T17:51:44","2022-09-08T21:40:13","/conventions/u-con-2022/schedule/415","Beginner","Average","3","Mechanical Muse","Dungeons and Dragons","5E","5' Round"
"Wonderlands War","264","Board and Card Game","David Miller","In Wonderland's War, take on the role of a faction leader who has been invited to the Hatter's tea party. Drink tea and eat cake as you move around the table drafting cards to gather your forces.","0","Teen (13+)","4","4","0","Saturday at 10:00 AM","2022-10-08T14:00:00","180","https://boardgamegeek.com/boardgame/227935/wonderlands-war","Ballroom","304","2022-08-05T20:02:53","2022-09-02T18:17:59","/conventions/u-con-2022/schedule/264","Beginner","Average","3",,,,"5' Round (7 chairs)"
"Munchkin Pathfinder","188","Board and Card Game","Nancy Hutchins","The award-winning game of killing monsters and taking their stuff meets the award-winning universe of the Pathfinder Roleplaying Game in Munchkin Pathfinder Deluxe!","0","Teen (13+)","6","6","0","Saturday at 10:00 AM","2022-10-08T14:00:00","120","https://munchkin.game/","Ballroom","303","2022-07-29T15:25:28","2022-09-13T02:41:26","/conventions/u-con-2022/schedule/188","Beginner","Average","3","Steve Jackson Games",,,"5' Round (7 chairs)"
"Formula D: Sotchi track","65","Board and Card Game","Mike Cook","Push your engine to the limit, hug the curves, pass to win! Rules will be taught. Race 2 of 2 for the 2022 U-Con Formula D Racing Champ. Must be present after this race to receive series winner prize.","0","Teen (13+)","10","3","0","Saturday at 10:00 AM","2022-10-08T14:00:00","180","http://","Ballroom","301","2022-07-23T19:00:47","2022-09-02T16:34:57","/conventions/u-con-2022/schedule/65","Beginner","Simple","2",,,,"5' Round (7 chairs)"
"Obsession w/Wessex and Upstairs Downstairs Expansions","242","Board and Card Game","Joe Capuano","Obsession has players build a deck of Victorian gentry. Recitals, Billiards, Political Debates, and Grand Balls increases a player's wealth, reputation, and connections among the elite.","0","Teen (13+)","3","2","0","Saturday at 10:00 AM","2022-10-08T14:00:00","240","http://","Ballroom","419","2022-08-03T23:42:03","2022-09-10T20:56:46","/conventions/u-con-2022/schedule/242","Beginner","Average","2","Ypsi Gaming Group",,"","8'x30"" Rectangle (6 chairs)"
"Foundations of Rome","360","Board and Card Game","Tony Armada","The city-building board game Foundations of Rome puts you into the role of an architect competing to own land and build magnificent structures!","0","Teen (13+)","4","4","0","Saturday at 10:00 AM","2022-10-08T14:00:00","180","https://boardgamegeek.com/boardgame/284189/foundations-rome","Ballroom","206","2022-08-11T13:02:43","2022-09-02T15:02:31","/conventions/u-con-2022/schedule/360","Beginner","Average","2","Oakland County Gamers",,,"8'x30"" Rectangle (6 chairs)"
"The Black Hack 2e: Introduction to Nu-SR Dungeoncrawling","261","Role Playing","Joshua t Carlton","Come get down and dirty in a randomized dungeoncrawl using my favorite OSR rules, The Black Hack 2e. 

This session will be a great intro to TBH2E, with character creation and a fun lil dungeon dive.","0","Adult (18+)","6","3","0","Saturday at 10:00 AM","2022-10-08T14:00:00","180","http://https://www.instagram.com/p/CiDXLdrOjud/?igshid=YmMyMTA2M2Y=","Conference H","Conference H 6","2022-08-05T12:20:01","2022-09-08T23:54:21","/conventions/u-con-2022/schedule/261","Beginner","Average","3",,"The Black Hack","2E","5' Round"
"Sentinels of the Multiverse -- Definitive Edition","79","Board and Card Game","Eric Kramp","Sentinels of the Multiverse is a cooperative fixed-deck superhero game in which the players work together to defeat a self-running villian with great variation. 2 games will be played per session.","0","Teen (13+)","5","0","0","Saturday at 11:00 AM","2022-10-08T15:00:00","120","https://boardgamegeek.com/boardgame/335212/sentinels-multiverse-definitive-edition","Ballroom","305","2022-07-23T19:04:40","2022-09-05T12:34:28","/conventions/u-con-2022/schedule/79","Beginner","Average","2",,,,"5' Round (7 chairs)"
"SJA-04 Spelljammer Academy: Behold H’Catha","454","Organized Play","Raven Lanier","Fourth adventure in the D&D 5e Spelljammer Academy story, though playing the other adventures is NOT necessary to play this adventure. Requires an Adventurers League playable level 4 character.","0","Teen (13+)","7","0","0","Saturday at 11:00 AM","2022-10-08T15:00:00","120","http://","Clubhouse","Clubhouse 7","2022-08-29T20:37:32","2022-09-01T17:25:36","/conventions/u-con-2022/schedule/454","Beginner","Simple","3",,"Dungeons & Dragons","5e","5' Round"
"When Tolls The Bell Of Ruin","172","Role Playing","Marzio Muscedere","Players must investigate a mysterious monastery and silence an infernal bell whose toll spreads calamity and doom across the countryside.  Play with the creator event, official DCC RPG playtest.","0","Adult (18+)","5","5","0","Saturday at 11:00 AM","2022-10-08T15:00:00","180","http://","Conference H","Conference H 3","2022-07-28T16:45:20","2022-09-05T17:57:06","/conventions/u-con-2022/schedule/172","Beginner","Average","3",,"Dungeon Crawl Classics",,"5' Round"
"Sorcerer City","217","Board and Card Game","Gary Loyola","Players create their tile-based City anew in each of six real-time rounds, gaining resources to buy new tiles and gain victory points, but they must be wary of monsters who invade their tile stack.","0","Teen (13+)","6","6","0","Saturday at 11:00 AM","2022-10-08T15:00:00","120","https://boardgamegeek.com/boardgame/235014/sorcerer-city","Ballroom","308","2022-08-03T23:33:24","2022-09-02T23:00:36","/conventions/u-con-2022/schedule/217","Beginner","Average","2","Oakland County Gamers",,,"6'x18"" Rectangle (6 chairs)"
"Star Trek: Five-Year Mission","129","Board and Card Game","Mark Kloha","Your five year mission aboard the U.S.S. Enterprise is ready to begin. ALERT! You and your fellow crewmates must cooperate to resolve dangerous situations that threaten to destroy your ship.","0","Teen (13+)","7","6","0","Saturday at 11:00 AM","2022-10-08T15:00:00","120","http://https://boardgamegeek.com/boardgame/178613/star-trek-five-year-mission","Ballroom","202","2022-07-28T14:37:29","2022-09-13T19:33:06","/conventions/u-con-2022/schedule/129","Beginner","Simple","2","Amorphous Blob Games",,,"6'x18"" Rectangle (6 chairs)"
"Auction Item Submission","267","Special Events","Nick Huston ","No ticket needed. The auction itself runs from 1pm to 3pm. We charge $1.00 or 10% of the winning bid, whichever is higher, per item sold.
See auction event at 1pm for additional details.","0","Family Friendly (7+)","24","1","0","Saturday at 11:00 AM","2022-10-08T15:00:00","120","http://","Auditorium 1","Auditorium 1","2022-08-06T16:07:59","2022-09-11T20:48:32","/conventions/u-con-2022/schedule/267"
"Set A Watch: Swords of the Coin","367","Board and Card Game","Evans Ward Collins","Set a Watch: Swords of the Coin is a fully cooperative game for 1-4 players. Every round you will visit all new locations and pick an adventurer to rest and get paid to take camp actions.","0","Family Friendly (7+)","4","0","0","Saturday at 12:00 PM","2022-10-08T16:00:00","120","https://boardgamegeek.com/boardgame/307386/set-watch-swords-coin","Ballroom","418","2022-08-11T13:03:34","2022-08-13T14:59:41","/conventions/u-con-2022/schedule/367","Beginner","Average","2",,,,"6'x30"" Rectangle (6 chairs)"
"Spike","29","Board and Card Game","allen stiles","","0","Adult (18+)","12","0","0","Saturday at 12:00 PM","2022-10-08T16:00:00","180","http://","Ballroom","317","2022-07-15T17:17:33","2022-08-05T18:01:45","/conventions/u-con-2022/schedule/29","Beginner","Average","3","Train Gamers Association",,"n/a","6'x18"" Rectangle (6 chairs)"
"Ticket to Ride","34","Board and Card Game","allen stiles","","0","Adult (18+)","12","0","0","Saturday at 12:00 PM","2022-10-08T16:00:00","180","http://","Ballroom","315","2022-07-15T17:17:52","2022-09-09T17:44:40","/conventions/u-con-2022/schedule/34","Beginner","Average","3","Train Gamers Association",,"n/a","6'x18"" Rectangle (6 chairs)"
"Battlestar Galactica","395","Board and Card Game","Victor M Lesperance","The classic hidden traitor game based on the TV show.  Humanity is fleeing to the stars with the robotic Cylons in hot pursuit.  Space combat, politics, treachery, deception, deduction, pretty models.","0","Teen (13+)","5","2","0","Saturday at 12:00 PM","2022-10-08T16:00:00","360","https://boardgamegeek.com/thread/1843057/battlestar-galactica-reimagined","Ballroom","302","2022-08-18T22:43:09","2022-09-10T01:24:27","/conventions/u-con-2022/schedule/395","Beginner","Average","4",,,,"8'x30"" Rectangle (6 chairs)"
"Lip Service A Legends of Barsaive Adventure","347","Role Playing","Matthew Holtz","Haven is the last stop before entering the great ruins of the old Theran capital of Parlainth. The PCs receive a message of help to find a missing aunt. This adventure is for 3-8 first circle PCs.","0","Teen (13+)","7","0","0","Saturday at 12:00 PM","2022-10-08T16:00:00","270","https://drive.google.com/drive/folders/1ZBPO3NOH5Tpxk42CIwm_yG0_Z40OBJsg?usp=sharing","Conference E","Conference E 6","2022-08-10T12:29:57","2022-08-13T14:50:59","/conventions/u-con-2022/schedule/347","Beginner","Average","3","None","Earthdawn","4th","6'x5' Rectangle"
"Where am i? ALICE in a Mad Tea Party","465","Board and Card Game","Kevin Hogan","This is a bluffing and deduction game.  Keep your identity secret while guessing the other players'.  Change seats!  Don't forget to put out the best tea set for where you sit down!","0","Family Friendly (7+)","4","0","0","Saturday at 12:00 PM","2022-10-08T16:00:00","60","http://","Ballroom","101","2022-08-30T23:40:58","2022-09-01T16:06:46","/conventions/u-con-2022/schedule/465","Beginner","Average","1",,,,"6'x18"" Rectangle (6 chairs)"
"Cascadia - Kid Friendly","597","Board and Card Game","Monique Rio","In this award winning game you are creating an ecosystem in the Pacific Northwest by laying tiles and animal tokens in good patterns. We'll be playing this with the Family or Intermediate variants.","0","Family Friendly (7+)","3","0","0","Saturday at 12:00 PM","2022-10-08T16:00:00","120","https://boardgamegeek.com/boardgame/295947/cascadia","Ballroom","211","2022-09-15T00:43:22","2022-09-15T00:46:47","/conventions/u-con-2022/schedule/597","Beginner","Average","1"
"Mutant Crawl Classics: The Museum at the End of Time","251","Role Playing","Justin Mohareb","In this adventure, the Tribe of the Cog’s rite of passage sends young adventurers out into the Glow Desert, where they discover and explore a well-preserved museum of the Ancient Ones.","0","Teen (13+)","5","4","0","Saturday at 12:00 PM","2022-10-08T16:00:00","240","http://","Conference H","Conference H 4","2022-08-03T23:45:51","2022-09-05T18:05:34","/conventions/u-con-2022/schedule/251","Beginner","Simple","3",,"Mutant Crawl Classics",,"6'x30"" Rectangle"
"Golem","389","Board and Card Game","Travis Stein","Golem is an engine-building game. The game is based on the 16th-century legend of the Golem of Prague, an anthropomorphic creature that Rabbi Loew animated from a clay statue to protect his people.","0","Adult (18+)","4","1","0","Saturday at 12:00 PM","2022-10-08T16:00:00","240","https://boardgamegeek.com/boardgame/298383/golem","Ballroom","413","2022-08-17T22:46:26","2022-09-08T00:18:38","/conventions/u-con-2022/schedule/389","Some XP","Complex","2",,,,"5' Round (7 chairs)"
"The Quiet Year","401","Role Playing","Tim","You have one year to rebuild after the war with the Jackals.  What do you do with your time before winter comes?  This game uses cards and map making to tell the story of a community rebuilding.","0","Teen (13+)","6","5","0","Saturday at 12:00 PM","2022-10-08T16:00:00","180","http://","Conference D","Conference D 3","2022-08-20T18:25:53","2022-09-13T01:42:17","/conventions/u-con-2022/schedule/401","Beginner","Average","2",,"The Quiet Year",,"5' Round"
"China Rails/Aussie Rails","11","Board and Card Game","allen stiles","Empire Builder crayon rails system.","0","Adult (18+)","24","1","0","Saturday at 12:00 PM","2022-10-08T16:00:00","180","http://","Ballroom","316","2022-07-15T17:16:37","2022-09-02T20:29:10","/conventions/u-con-2022/schedule/11","Beginner","Average","3","Train Gamers Association",,"n/a","6'x18"" Rectangle (6 chairs)"
"Dixit","472","Board and Card Game","Meri Orosz","A player will tell a short phrase or word to match the image on their card. The players must select cards that match that word or phrase and then attempt to guess storyteller's card out of everybodys.","0","Family Friendly (7+)","5","2","0","Saturday at  1:00 PM","2022-10-08T17:00:00","120","http://","Ballroom","207","2022-09-01T15:16:48","2022-09-09T00:34:31","/conventions/u-con-2022/schedule/472","Beginner","Simple","2",,,,"6'x18"" Rectangle (6 chairs)"
"Trajan","50","Board and Card Game","William Frisk","Players use a Mancala action wheel to select their actions that will allow them to increase their influence and power in various areas of ancient Roman life such as politics, military and trade.","0","Adult (18+)","4","3","0","Saturday at  1:00 PM","2022-10-08T17:00:00","180","http://https://boardgamegeek.com/boardgame/102680/trajan","Ballroom","425","2022-07-23T18:43:16","2022-09-09T20:15:17","/conventions/u-con-2022/schedule/50","Beginner","Complex","1",,,,"6'x30"" Rectangle (6 chairs)"
"Western Legends","400","Board and Card Game","Rachel Vacek","In Western Legends, become a gun-toting outlaw or a law-abiding marshal in this American Wild West sandbox. Gamble, drive cattle, prospect for gold, rob the bank, fight bandits, and pursue stories!","0","Adult (18+)","5","5","0","Saturday at  1:00 PM","2022-10-08T17:00:00","180","https://boardgamegeek.com/boardgame/232405/western-legends","Ballroom","208","2022-08-20T18:24:40","2022-09-03T13:31:22","/conventions/u-con-2022/schedule/400","Beginner","Complex","2","University of Michigan Library Staff Gaming Guild",,,"8'x30"" Rectangle (6 chairs)"
"Nefarious","122","Board and Card Game","Becky Reamy","Nefarious is a quick-playing game in which the players race to build inventions like a freeze ray, cloaking device, or robotic pet before their opponents can do the same.","0","Teen (13+)","6","5","0","Saturday at  1:00 PM","2022-10-08T17:00:00","120","http://","Ballroom","203","2022-07-28T14:36:42","2022-09-14T15:25:44","/conventions/u-con-2022/schedule/122","Beginner","Average","4","Amorphous Blob Games",,,"6'x30"" Rectangle (6 chairs)"
"Tiny Epic Dungeons","133","Board and Card Game","Blair Reamy","A fully cooperative dungeon crawler set in the fantasy world of Aughmoore. Control a band of heroes exploring a treacherous dungeon in search of the fearsome Dungeon Boss.","0","Teen (13+)","4","4","0","Saturday at  1:00 PM","2022-10-08T17:00:00","120","https://www.gamelyngames.com/product/tiny-epic-dungeons-deluxe/","Ballroom","204","2022-07-28T14:37:43","2022-09-03T20:27:09","/conventions/u-con-2022/schedule/133","Beginner","Average","2","Amorphous Blob Games",,,"6'x30"" Rectangle (6 chairs)"
"Paint and Take","421","Miniatures","Doug  Houseman","Come choose a miniature, sit down and paint it. Paints, brushes, and miniatures are supplied, Miniatures will be priced based on cost, please pay at Paint and Take","0","Teen (13+)","8","0","0","Saturday at  1:00 PM","2022-10-08T17:00:00","300","http://","Ballroom","105; 106","2022-08-27T19:24:29","2022-08-31T17:31:10","/conventions/u-con-2022/schedule/421","Beginner","Simple","1","",,,"72 x 30"
"Foundations of Rome","359","Board and Card Game","Tony Armada","The city-building board game Foundations of Rome puts you into the role of an architect competing to own land and build magnificent structures! Build domūs and insulae, fountains, foundries, and more","0","Teen (13+)","4","4","0","Saturday at  1:00 PM","2022-10-08T17:00:00","180","https://boardgamegeek.com/boardgame/284189/foundations-rome","Ballroom","206","2022-08-11T13:02:39","2022-09-02T15:08:06","/conventions/u-con-2022/schedule/359","Beginner","Average","2","Oakland County Gamers",,,"8'x30"" Rectangle (6 chairs)"
"Warehouse 13","137","Board and Card Game","Cheryl Orosz","Endless Wonder awaits in this expression of the cult classic Sci Fi TV show. As a Warehouse Agent, your job is to retrieve potentially dangerous artifacts from the field and keep them safe.","0","Teen (13+)","5","1","0","Saturday at  1:00 PM","2022-10-08T17:00:00","300","https://boardgamegeek.com/boardgame/204055/warehouse-13-board-game","Ballroom","311","2022-07-28T14:38:08","2022-09-02T23:15:01","/conventions/u-con-2022/schedule/137","Beginner","Average","2",,,,"6'x18"" Rectangle (6 chairs)"
"Auction","266","Special Events","Nick Huston ","No ticket needed. Registration of items from 11am to 1pm. We charge $1.00 or 10% of the winning bid, whichever is higher, per item sold. No inspections of lots prior please. All sales are final.","0","Family Friendly (7+)","24","9","0","Saturday at  1:00 PM","2022-10-08T17:00:00","120","http://","Auditorium 1","Auditorium 1","2022-08-06T16:07:43","2022-09-14T17:35:56","/conventions/u-con-2022/schedule/266"
